Degree of endangerment,Name in English
Vulnerable,"Aruaco, Maiya, Garhwali, Tangsa, Baníwa do Içana, Kandas, Awajun, Shanenawa, Wichi, Qikiqtaaluk nigiani, Tause, Gupapuyngu, Khiamngan, Bribri (Costa Rica), Yanomami (Brazil), Bainouk-Gunyaamolo, Baheng (Viet Nam), Wayana (Brazil), Duwet, Guajá, Tucano (Colombia), Phunoi, Patani Malay, Arara do Pará, Kaki Ae, Bosilewa, Southeastern Tarahumara, Minyong, Chimané, Kaiep, Kaiy, Panará, Lower Mixe, Lehali, Bodo, Löyöp, Nyangumarta, Maram, Kheng, Spiti, Waiwai (Guyana), Apalai, Karitiana, Mbya Guarani (Brazil), Wauja, Matís, Nambiquara do Norte, As, Scanian, Cashinahua (Brazil), San Andres Creole, Kaningara, Picuris, Serili, Chepang, Rhenish Franconian, Ampibabo Lauje, Araweté, Bade, Purik, Ikpeng, Barí, Bokar, Karo, Pashayi, Oji-Cree, Akatek (Guatemala), Korúbo, Padri, Huichol, Central Tlapanec, Cubeo (Colombia), Mawé, Northwestern Otomí, Myky, Damal, Apatani, Dongotono, Galo, Korwa, Labo, Nivaclé, Fayu, Bierebo, Awyi, Auye, Kisêdjê, Yudja, Limburgian-Ripuarian, Hopi, Emae, Erokwanas, Pirahã, Thakali, Phula (China), Sanema (Venezuela), Iwaidja, Kokota, Gutob, Koneraw, Sengseng, Sikuani, Magori, Guaraní Boliviano, Maung, Dimme, Mehináku, Sora, Lower Northwestern Otomí, Numbani, Nung Ven, Liangmai, Zeme, Sepa, Shark Bay, Highland Mazatec, Uru-eu-au-au, Kamaiurá, Saulteau, Konyak, Bedoanas, Jarawára, Zo'é, Satār, Nocte, Ao, Namuyi, Thuri, Jola-Kassa, Kheza, Aweti, Padoe, Bussa, Patamona (Guyana), Onjab, Lauje, Western Mazatec, Tuvan, Figuig, Arguni, Yecuana (Venezuela), Baki, K'iche' (Guatemala), Amis, Waxiang, Katxuyana-Xikuyána, East Franconian, Romani (Colombia), Malmariv, Biak, Moose Cree, Northern Tlapanec, Miju, Khalaj, Yecuana (Brazil), Chichimec, Taroko, Kivallirmiutut, Micmac (Canada), Gavião de Rondônia, Northern East Cree, Enawenê-Nawê, Rarotongan, Puebla Mazatec, Bumthang, Quechua of Southern Bolivia, Qikiqtaaluk uannangani, Khowar, Nanti, Wab, Bavarian, Chara, Wotu, Balti, Wambule, Khasi, Zhaba, Taworta, Alemannic, Kanela Apaniekra, Yulu, Southern East Cree, Suruahá, Sanema (Brazil), Zoró, Ninam (Brazil), Wapishana (Guyana), Gavião do Pará, Tucano (Brazil), Sierra Otomí, Pukobyê, Reshe, Nauna, Tafi, Asurini do Xingu, Budibud, Dâw, Embera (Panama), Kumaoni, Obokuitai, Eastern Montagnais, Kui, Guichong, Talysh, Atikamekw, Western Zoque, Seke, Burji, Rusyn, Pemon (Brazil), Mon, Ormu, Onin, Baheng (China), Mikasuki, Dubu, Quechua of Peruvian Amazonia, Laxudumau, Maonan, Gondi, Mebengokre, Eastern Slovak, Central Pame, Gera, Khmin, Banawá Yafi, Bhumji, Mulam, Irula, Dabra, Busoa, Cabécar, Kharia, Khorasani Turk, Tagin, Napu, Macushi (Guyana), Rahambuu, Wancho, Shingsaba, Tialo, Korku, Ninam (Venezuela), Kalapalo, Quechua of Cuzco, Tennet, Seri, Polesian, Yawanawá, Wampis, Naskapi, Akatek (Mexico), Tamang, Pauwi, Aymara, Rongpo, Western Tlapanec, Adyge, Karore, Yanomám, Gao, Mundurukú, Karachay-Balkar, West Greenlandic, Guajiro, Tapirapé, Xaragure, Senggi, Yanomami (Venezuela), Nupbikha, Western Cham, Feroge, Wuse, Tshangla, Uspantek, Konni, Yaminahua (Brazil), Meithei, Thado, Avar, Mzieme, Pintupi, Ghale, Sierra Popoluca, West Frisian, Dene, Kuikuro, Kowiai, Tofanma, Northwestern Tlapanec, Hodi, Hoava, Hixkaryána, Nayi, Patamona (Brazil), Kurux (Nepal), Mundari, Ixcatlán Mazatec, Northern Popoloc, Itik, Yuhup (Brazil), River Guarijío, Garífuna (Guatemala), Eastern Popoloc, Wanano / Kotiria (Brazil), Paite, Soyaltepec Mazatec, Siriano (Brazil), Central Cuicatec, Krikati, Awera, Mountain Guarijío, Adi, Sak (Myanmar), Ngaanyatjarra, Isthmus Náhuatl, Lakon, Zuni, Sunwar, Enggano, Panamahka, Hmar, Lisela, Northwestern Ojibwe, Mancagne, Nambiquara do Sul, Eloxochitlán Mazatec, Jawe, Chuvash, Cuona Menba, Woods Cree, Lhota, Ocopetatillo Mazatec, Nunavimmiutitut, Central Cagayan Agta, Western Tarahumara, Nyishi, Santa, Tuyuca (Brazil), Taulil, Taruang, Gurrgoni, Choctaw (Oklahoma), Mursi, Choctaw (Mississipi), Jamamadí, Pendau, Ayautla Mazatec, Koda, Eastern Tlapanec, Ngäbere (Panama), Ashaninka (Brazil), Lola, Choctaw (Louisiana), Kumak, Awakatek (Guatemala), Paloor, Kogui, Miskito (Honduras), Vidunda, Dení, Welsh, Besoa, Bantawa, Caac, Angika, Sioux, Dzongkha, Q'eqchi' (Guatemala), Lak, Norfolk-Pitcairn (Pitcairn), Jemez, Wajãpi, Tayal, Machineri (Brazil), Latgalian, Koitabu, Anal, Drubea, Bakairi, Kunwinjku, Hadza, Ka'apór, Rabha, Talu, |Gui, Taba, Tamzabit, Sherpa, Panare, Pilagá, Moselle Franconian, Trio (Suriname), Pitjantjatjara, Tombelala, Kwansu, Nyenkha, Central Náhuatl, Legenyem, Rotuman, Chechen, Ediamat, Sherdukpen, Tangkhul, Maring, Ñandeva Guarani, Bashkir, Paiter, Q'aanjob'al, Chuj (Guatemala), Naueti, Lalo, Warlpiri, Yukpa, Western Montagnais, Waiwai (Brazil), Kokborok, Stoney, Kuot, Kukatja, Kurtöp, Kodeoha, Faroese, Kayabi, Macuna (Brazil), Kairui-Midiki, Southwestern Tepehuan, Angami, Basque, Karone, Tabasaran, Yami, Rengma, Karang, Hualapai, Kabard-Cherkes, Nruanghmei, Plains Cree, Habu, Kuna (Panama), Guugu Yimidhirr, Chang, Gongduk, Higher Reservoir Mazatec, Kohi, Faghani, Chilchotla Mazatec, Abkhaz, Burunge, Bunun, Ashaninka (Peru), Phom, Pisaflores Tepehua, Mayoruna (Peru), Bangni, Baima, Chamorro, Bora, Ho, Northwestern Tarahumara, Sicilian, Kurux (Bangladesh), Malinaltepec Tlapanec, Navajo, Kaiowá Guarani, Adabe, Bandial, Low Saxon, Acatepec Mazatec, Martuwangka, West Flemish, Bukiyip, Central Alaskan Yupik (Nuniak Island), Central Alaskan Yupik (2), Sampang, Noon, South Italian, Southwestern Tlapanec, Khoirao, Fagauvea (Southern), Fagauvea (Northern), Waunana (Colombia), Waimirí-Atroarí, Fwâi, Ingush, Piaroa (Venezuela), Trio (Brazil), Huehuetlán Mazatec, Akawaio (Brazil), Northern Algonquin, Torlak, Bara (Brazil), Manchad, Tsou, Tai Neua, Maori, Padam, Dakka, Pemon (Venezuela), Tuwuli, Bumbita Arapesh, Tacenwit, Tamahaq (Algeria), Aivilingmiutut, Marúbo, Bishnupriya Manipuri Creole, Murik, Maxakali, Filomeno Mata Totonac, Karbi, Yaqui (Mexico), Tecóatl Mazatec, Kaqchikel (Guatemala), Palikur (Brazil), Venetan, Karipuna do Amapá, Zazaki, Krahô, Dimasa, Tajio, Kurripako (Brazil), Ladakhi, Kanela Rankokamekra, Salar, Muya, Tai Daeng, Dupaninan Agta, Cinta Larga, Yakut, Simi, Natsilingmiutut, Wik Mungkan, Wayana (Suriname), Chru, Kumyk, Saluan, Huasteca Náhuatl, Pyuma, Alune, Katukína-Kanamarí, Tiwi, Mazatlán Mazatec, Scots, Mayoruna (Brazil), Q'eqchi' (Belize), San Mateo del Mar Huave, Zaozou, Hrangkhol, Karajá, Mam (Guatemala), Anindilyakwa, Arrernte, Phurhepecha, Kulung, Lowland Mazatec, Kurux (India), Bassari, Boano, Apinajé, Mao, Northern Cuicatec, Akwáwa, ǁGana, Bayot, Khampti, Dondo, Xavante, Gusilay, Uhunduni, Pochuri, Yem, Eastern Cuicatec, Upland Yuman, Dogrib, Guajajara, Culina (Brazil), Achi', Ossete, Swampy Cree, Ixil (Guatemala), Andio, Garífuna (Belize), Sangtam, Chokri, Belarusian, Galibi Marworno, Burushaski, Tulu, Totoli, Tayurayt, Lemolang, Mizo, Isirawa, Grass Koiari, Lezgian, Gebe, Ghadames, Oyda, Paiwan, Hupda (Brazil), Heiban, Jero, Yimchungru, Waotededo, Naluo, Poqomchi', Urarina, Dargwa, Macushi (Brazil), Brahui, Amba, Tanglang, Kwama, Miskito (Nicaragua), Tamajeq, Quechua of Northern Bolivia, Suba, Shughni, Sangkong, Dzala, Rukai, Hlersu, Garífuna (Honduras), Kabui, Momuna, Embera (Colombia), Nguon, Muda"
Severely endangered,"Yaeyama, Nheengatu / Yeral (Venezuela), Gurdu-Mbaaru, Ottawa (Walpole Island), Sáliba, Yonaguni, Shoshoni (Idaho), Koke, Shoshoni (Nevada), Shoshoni (Wyoming), Northern Selkup, Tai Phake, Penrhyn, Laemae, Ukhwejo, Languedocian, Thompson, Soqotri, Judezmo (Europe), Quichua (Cañar and Azuay), Inari Saami, Siona / Secoya (Ecuador), Semai, Shatt, Istriot, Kashubian, Sonsorol, Kung, Ajuru, Jicarilla Apache, Kumzari, Bainouk-Samik, Andoke, Kickapoo (Kansas), Woleaian, Tewa (New Mexico), Bashkarik, Rumai, Chintang, Forest Nenets, Tagoi, Tempuan, Jah Hut, Jeri, Jonkor Bourmataguil, Southern Tlapanec, Transylvanian Saxon, K'emant, Mosetén, Toba-Maskoy, Karelian (Tikhvin), Kendem, Orang Seletar, Badiaranke, Movima, Puluwat, Samei, Turoyo, Inga, Kili, Touggourt Tamazight, Guernsey French, Kanga, Paafang, Taznatit, Zapotec of the Valleys north, Udi (Georgia), Ojibwe, Geji cluster, Sanyi, Cypriot Arabic, Besme, Acheron, Lohorung, Kickapoo (Oklahoma), Buyang, Kickapoo (Texas), Temuan, Kiowa, Raute, Western Popoloc, Nganasan, Mah Meri, Jakaltek (Mexico), Kari'ña (Venezuela), White Gelao (China), Fania, Southern Paiute, Ubi, Yanesha, Krueng, Mam (Mexico), Munji, Kangjia, Tunisian Judeo-Arabic (Israel), Amahuaca, Kuay, Arbanasi, Kumāle, Warnang, Yazva Komi, Western Náhuatl, Darai, Alutor, Faire Atta, Baniva, Ndunda, Lengua, Arapaho (Wyoming), Beeke, Bohtan Neo-Aramaic, Chukchi, Bats, Lorrain, Chong, Cherokee (North Carolina), Rapa, Tumtum, Sirionó, Cocama-Cocamilla (Peru), Dair, Domaaki, Ega, El Hugeirat, Yaminahua (Bolivia, Peru), Fongoro, Gambiri, Judezmo (Israel), Hulaula (Israel), Ishkashimi, Ganan, Iyive, Kaande, Kryz, Kensiw (Thailand), Quechua of Cajatambo, Pasco and northern Junín, Kadu, Kari, Lokono (Suriname), Guatuso, Mahongwe, Lishana Deni (Israel), Manchurian Ölöt, Northern Tujia, Mbara, Mech, Limousin, Stieng, Wa, Ngwaba, Langa, North Frisian, Maliseet-Passamaquoddy, Sake, Saterlandic, Palikur (French Guyana), Shumashti, Quichua (Loja), South Saami, Sighu, Otoro, Tawahka, Thavung (Thailand), Tuotomb, Yatê, Natanzi, Mixtec of Zapotitlán, Parya, Southern Tujia, Nauruan, Ulwa, Nheengatu / Yeral (Brazil), Zay, Miraña (Colombia), Ute (Colorado, Ute Mountain), Istro-Romanian, Mixtec of San Pedro Tidaá, Tamazight (Tunisia), Eliri, Segeju, Namonuito, Yerong, Toram, Mewahang, Awapit, Warekena (Venezuela), Tanimuca-Letuama, A'tong, A'ingae / Cofan (Colombia), Ixtenco Otomí, Satawal, Halkomelem, Nogay (Crimea), Auvergnat, Baraba Tatar, Chimila, Nogay (Dobruja), Temein, Njalgulgule, Kosraean, Pech, Shabo, Norman, Rikbaktsa, Tapieté, Arvanitika, Kuna (Colombia), Santa María del Mar Huave, Sharanahua, Ottawa (Canada), Bati, Quechua of San Martín, Chorote Iyojwa'ja, Northern Altay, Brao, Waunana (Panama), Burgundian, Sera, Champenois, Eman, Isu, Western Otomí, Crimean Turkish, Nubaca, Tlahuica, Buryat (Cis-Baikal), Domari, Tasnusit, Kildin Saami, Jaqaru, Maslam, Katukina do Acre, Even (Kamtchatka), Helong, Tat, Gitksan, Indri, Mopán (Belize), Even (Siberia), Yazgulami, Shor, Tulishi, Evenki (Northern Siberia), Evenki (Sakhalin), Evenki (Southern Siberia), Tenharim, Piratapuya (Brazil), Palaung, Pale, Nivkh (Sakhalin), Franc-Comtois, Keiga, Carrier, Phnong, Huzhu Monguor, Central Popoloc, Mru, Gagauz (South Balkans), Gangou, Beezen, Cheyenne (Oklahoma), Eastern Ojibwe, Homshetsma (Caucasus), Poitevin-Saintongeais, Ocoyoacac Otomí, Dahalo, Tazy, Bubia, Gardiol, Émérillon, Gagauz (Maritime), Hobyot, Chickasaw, Patla-Chicontla Totonac, Hya, Mambai, Lule Saami, Koryak, Kona, Mapuche (Argentina), Ik, Wagiman, Griko (Calabria), Umpila, Ngaatjatjara, Karuk, Aruá, Jingulu, Chilisso, Jaminjung, Crimean Tatar (Crimea), White Gelao (Viet Nam), Terena, Wajarri, Aiton, Nyikina, Nyamal, North Alaskan Inupiaq (North Slope), North Alaskan Inupiaq (Kotzebue Sound), Kristang, Jaya, Kulina Páno, Koko Bera, Sierra Totonac, Jawoyn, Highland Chontal, Raji, Cuiba, Mopán (Guatemala), Bundjalung, Bom, Mariupolitan Greek, Semelai, Sām, Kuku Yalanji, Washo, Wardaman, Sanglechi, Roshorvi, Remo, Rapanui, Pingelapese, Sakurabiat, Mor, Griko (Salento), Khinalug, Dhimal, Crimean Tatar (Dobruja), Wik Ngencherr, Warnman, Valley Yokuts, Ske, Bribri (Panama), Xerente, Ngalkbun, Logol, Djeoromitxi, Bardi, Kri, Northern Mansi, Barasana (Brazil), Jersey French, Yoki, Ulithian, Tipai (United States of America), Shira Yugur, Garrwa, Bunuba, Asumboa, Nunggubuyu, Mudburra, Warumungu, Tanimbili, Tanaina, Tambotalo, Sian, Nanay, Mbya Guarani (Argentina, Uruguay), Salas, Lude, Lishanid Noshan (Israel), Provençal, Kapingamarangi, Ngarinman, Nakkara, Moraori, Picard, Makurap, Majhi, Gura, Geta?, Fyem, Karaim (Lithuania), Gorovu, Budukh, Bonjo, Banjima, Arabela, Awjila, Moere, Csángó Hungarian, Faita, Bepour, Tapayuna, Mosimo, Tembé, Olultecan, Ngangikurunggurr, Kija, Gooniyandi, Tima, Carapana (Brazil), Morokodo, Sumariup, Bothar, Yapunda, Yanyuwa, Western Chocho, Vilamovian, Sibe, Iresim, Doutai, Anung (Myanmar), Anus, Teko, Arawun, Papi, Musan, Mores, Nachiring, Tobati, Pwapwa, Mari, Gong, Dorro, Ari, Araona, Ak, Narau, Taiap, Iteri, Mindiri, Samosa, Yarawata, Tocho, Vehes, Ute (Colorado, Southern Ute), Khang Quang Lam, Zenaga (Mauritania), Shiwiar, Shawnee, Seneca (United States of America), Sahaptin, Pyu, Piame, Oroha, Nafi, Mulao, Mohave (California), Mohave (Arizona), Maricopa, Kofei, Karas, Kanowit, Kalamo, Lishan Didan (Israel), Kari'ña (Guyana, Suriname), Evenki (Manchuria), Comanche, Quechua of Cajamarca, Burate, Bikaru, Arem, Ainbai, Baga Sitemu, Gallo, Ili Turk, Capanahua, Tagargrent, Puma, Yuki, Ocaina (Colombia), Ebang, Kutenai, Judeo-Berber (Israel), Machineri (Bolivia), Kunbarlang, Tokelauan, Nomatsiguenga, Afitti, Yavapai, Saryg Yugur, Ket, Gwich'in (United States of America), Camarines Norte Agta, Cacua, Udi (Azerbaijan), Aleut (Western), Nafusi, Kaska, Sonora Lower Pima, Danuwar, Pije, Moroccan Judeo-Arabic (Morocco), Molise Croatian, Straits Salish, Keder, Eastern Chocho, Tipai (Mexico), Nootka, Megleno-Romanian, Töitschu, Theen, Southern Chocho, Saisiyat, Pacific Gulf Yupik, Orejón, Korandje, Northern Alta, Ningalami, Khojki, Wanka Quechua, Kami, Kalasha, Ingrian, Jibbali, Gowro, Dukha, Central Siberian Yupik (Chukotka), Bonggo, Breton, Baras, Bana, Bartangi, Mixtec of the northeast lowlands, Chontal Tabasco, Neku, Western Mari, Paipai, Lafofa, Siglitun, North Alaskan Inupiaq (Canada), Mixtec of San Miguel Piedras, Zapotec of San Bartolo Yautepec, Winnebago (Wisconsin), Winnebago (Nebraska), Texistepecan, Sause, Pear, Lillooet, Gwich'in (Canada), Zapotec of the Valleys, central, Nisga'a, Cocopa (Arizona), Sak (Bangladesh), Maniwaki Algonquin, Achagua, Paumarí, Tilapa Otomí, Yimas, Yawarana, Dameli, Warapu, Ngile, Ute (Utah), Tuahka, Kwatay, Tarpia, Skolt Saami, Veps, Tetserret, Mangareva, Nayini, Usu"
Extinct,"Hanis, Tobada', Tamazight (Ait Rouadi), Western Abenaki (United States of America), Canichana, Lae, Uru, !Gan!ne, Unami, Aasax, Ahom, Tolcha, Ainu (Kuril), Ainu (Sakhalin), Akkala Saami, Alderney French, Amanayé, Andoa (Ecuador), Andro, Antoniano, Aore, Sogoo, Apolista, Arapaho (Oklahoma), Arapáso, Aribwatsa, Arin, Arman, Arta, Atacameño, Atsugewi, Babuza, Baga Kalem, Quinault, Barbareño, Barzani Jewish Neo-Aramaic (Iraq), Basay, Baygo, Berakou, Berti, Bina, Birgid, Boro, Cacaopera, Cape Khoekhoe, Cappadocian Greek (Turkey), Catawba, Cayuga (Oklahoma), Cayuse, Central Kalapuyan, Chairel, Cholon, Coptic, Cowlitz, Culle, Cuman, Cupeño, Dalmatian, Deti, Dicamay Agta, Dorasque, Dororo, Duli, Macaguaje, Dungidjau, Dura, Eastern Abenaki, Eastern Kamchadal, Eastern Pomo, Eel River Athabaskan, Elmolo, Eotile, Eyak, Gaagudju, Gafat, Ge'ez, Getmata, Gey, Gothic, Guanche, Gule, Guliguli, Gününa Küne, Hulaula (Iran), Kulun, Hoanya, Homa, Horo, Hpun, Huitoto (Brazil), Hukumina, Huron-Wyandot (United States of America), Ifo, Ineseño, Island Carib, Chiwere, Island Chumash, Judeo-Berber (Morocco), Kamas, Kamas Turk, Carabayo, Kaniet, Kansa, Karaim (Crimea), Karami, Karelian (Valday), Katabaga, Kato, Kayeli, Kazukuru, Kede, Kemi Saami, Kenaboi, Kerek, Ketangalan, ǁXegwi, ǁKx'au, ǁKu ǁ'e, |Xam, |'Auni, Zeem, Yurutí (Brazil), Yurats, Yuki, Yug, Yola, Yoba, Yir Yoront, Yameo, Yaaku, Xakriabá, Wiyot, Western Mansi, Wappo, Kilit, Kinare, Vilela, Ventureño, Urupá, Uruava, Upper Umpqua, Upper Chehalis, Umutina, Ubykh (Turkey), Ubykh (Caucasus), Twana, Tututni, Tunica, Tsetsaut, Torá, Tonjon, Togoyo, Tillamook, Tetete, Te'un (Te'un Island), Taokas, Tandia, Taman, Subtiaba, Soyot, Southern Mansi, Southern Khanty, Southern Kamchadal, Southeastern Pomo, Slovincian, Siuslaw, Sishee, Siraiya, Kurtjar, Seward Peninsula Inupiaq (Big Diomede Island), Seru, Serrano, Sengmai, Sened, Sei, Klamath-Modoc, Rangkas, Qwarenya, Quileute, Quapaw, Pyu, Purisimeño, Pumpokol, Polabian, Piru, Pijao, Phalok, Pentlatch, Papora, Panobo, Palumata, Orang Kanaq, Opon-Carare, Ongkor Solon, Ona, Konomihu, Old Sirenik, Old Prussian, Odut, Obispeño, Nyang'i, Nukiní, Northeastern Pomo, Norn, Nooksack, Nisenan, Nila (Nila Island), Ngong, Ngarla, New River Shasta, Natchez, Napore, Naka'ela, Nagumi, Múra, Mulaha, Mozarabic, Molala, Moksela, Mochica, Mo-peng, Mlahso (Turkey), Mlahso (Syria), Kore, Kott, Migueleño, Miami-Illinois, Mattole, Mator, Matagalpa, Marrgu, Maragus, Mapia, Malin, Máku, Mahigi, Lower Chehalis, Lorkoti, Krenjê, Lishanid Noshan (Iraq), Lishana Deni (Iraq), Lishan Didan (Iran), Lipan, Liliali, Li-Ngbee, Lenca, Krevin, Laghu, Kyakala, Kwisi, Kwadi, Kw'adza, Singa"
Definitely endangered,"Asur, Langthang Tibetan, Loke Tibetan, Lombard, Romani, Yiddish (Israel), Emilian-Romagnol, Piedmontese, Kangdi, Khaccaḍ Bhoṭe, Aché, Ligurian, Campidanese, Amami, Quechua of Ayacucho, Newar, Tamaceq, Mandeali, Friulian, Quechua of Ancash and Huánuco, Bhalesi, Walloon, Mising, Aromanian, Cavineña, Mahasui, Central Asian Arabic, Magar, Udmurt, Eastern Mari, Erzya, Logudorese, Desano (Colombia), Mapuche (Chile), Mingrelian, Gurung, Buryat (Trans-Baikal), Kurru, Kuvi, Homshetsma (Turkey), Gyasumdo, Limbu, Jad, Moroccan Judeo-Arabic (Israel), Plautdietsch, Pontic Greek, Jitnu, Juhur (Israel), Quichua (Cotopaxi, Tungurahua and Chimborazo), Oyrat, Gascon, Suret, Khasali, Koro, Malto, Komi, Kunigami, Alpine Provençal, Moksha, Western Armenian (Middle East), Lua, Macuna (Colombia), Maká, Gagauz (Bessarabia), Kului, Kodagu, Corsican, Kalmyk, Asturian-Leonese, Badaga, Miyako, Mohawk (Ganienkeh), Mohawk (Kahnawake), Mohawk (Kanatsiohareke), Mohawk (Kanesatake), Mohawk (Six nations), Mohawk (Tyendinega), Mohawk (Wahta), Mok (Lao PDR), Mosquitia Creole, Muinane, Laz, Chambeali, Kolami, Sassarese, Nukak, Okinawan, Konda, Jaunsari, Panamanian Creole, Dagur (Nonni), Francoprovençal, Gallurese, Rama Cay Creole, Mehri, Ordos, Permyak, Nogay (Caucasus), Mezquital Otomí, Sanapaná, Eastern Mazahua, Siberian Tatar, Central Otomí, Siriano (Colombia), Arbëresh, South Jutish, Lari, Tacana, Páez, Quechua of Santiago del Estero, Svan, Razihi, Tati, Tatuyo, Wakhi, Tuyuca (Colombia), Bhadravahi, Kinnauri, Gallo-Sicilian, Tz'utujil, Churahi, Urum, Torwali, Kachari, Scottish Gaelic, Sierra de Puebla Náhuatl, Limonese Creole, Khakas, Buryat (Manchuria), Wanano / Kotiria (Colombia), Eastern Cham, Quichua (Imbabura), Southern Altay, Võro-Seto, Western Armenian (Turkey), Zaramo, Papantla Totonac, Cosung (China), Cosung (Viet Nam), Lumun, Chamling, Irish, Phuthi, Dungan, Laro, Quichua (Napo), Muji, Romansh, Shuar chicham, Ticuna, Jakaltek (Guatemala), Thangmi, Abaza, Koch, Burgenland Croatian, Dzhidi, Kham, Ladin, Lepcha, Mok (Myanmar, Thailand), Moro, North Saami, Quichua (Pastaza), Rushani, Toba, Tundra Nenets, Vojvodina Rusyn, Agul, Rutul, Bateri, Deori, Western Mazahua, Banat Bulgarian, Minhe Monguor, Olonetsian, Saek, Tamazight (Beni Iznassen), Tsakhur, Warao, Jone, Andi, Guambiano, Hawrami, Juang, Tiwa, Mara, Polci cluster, Sarikoli, Krongo, Ashtiani, Khunsari, Semnani, Zapotec of the Valleys, middle northwest, Aluo, Bru, Cho-ca-nga-ca-kha, Karelian (Karelia), Tangwang, Western Neo-Aramaic, Yaghnobi, Yaw, Yeyi, Boro, Sorbian, Biete, Kati, Kaingang, Vafsi, Tamahaq (Libya), Shipibo-Conibo, Tsez, Bonan, Chrau, Dari, Ersu, Gangte, Ha-lung Tibetan, Juk, Lavua, Nahali, Nyoe, O'odham (Akimel), O'odham (Tohono), Rao, Siwi, Tuamotuan, Katla, Thulung, Bawm, Niuean, Nalu, Karko, Kadaru, Chamalal, Hill Miri, Jinuo, Yucuna, Yurt Tatar, Ch'orti' (Guatemala), Komo, Poqomam, Idu, Machiguenga, Tuvaluan, Saparua, Bongo, Algherese Catalan, Aragonese, Bukharic, Chayahuita, Cherokee (Oklahoma), Dalecarlian, Huitoto (Colombia, Peru), Karelian (Tver), Kurripako (Colombia, Venezuela), Miqie, Mojo, Northern Khanty, Nyah Kur, Orang Hulu, Solon, Yurutí (Colombia), Temiar, Trukhmen, Gawar-Bati, Khaling, Phula (Viet Nam), Dol-po, Motuo Menba, Ts'amay, Phalura, Micmac (Massachusetts), Austral dialects, Belanda Bor, Hachijō, Lajia, Lakha, Mbya Guarani (Paraguay), Quichua (Salasaca), Tingal, Wunai Bunu, Pana, Puinave, Tunebo, Bashkardi, Choyi, Gazi, Karagash, Sivandi, Soi, Sakapultek, Northern Tepehuán, Rio Grande Keresan, Beli, Chesu, Karata, Chiquitano (Bolivia), Bezhta, Moklen, Parachi, Sulung, Tindi, Western Apache, Chantyal, Karipuna, Mortlockese, Akawaio (Guyana, Venezuela), Akhvakh, Sipakapense, Central Zoque, Yidgha, Dilling, San Dionisio del Mar Huave, Akeu, Bagvalal, Bambassi, Brokpa, Creek, Dagur (Hailar), Dhaiso, Gorum, Guarayu, Gutnish, Kathu, Khwe, Kom, Lachi, Mak, Manihiki, Miji, Mo'ang (China), Mo'ang (Viet Nam), Pume, Singpho, Turi, Jirel, Dolgan, Tsum, Zapotec of Petapa, Dungmali, Mixtec of Tlaltempan, Piapoko, Arbore, Gyele, Bwisi, Acoma-Laguna, Aka, Baga Manduri, Botlikh, Bunan, Cashinahua (Peru), Cha'palaa, Gazhuo, Godoberi, Maleng, Sinkiang Dagur, Taa, Wapishana (Brazil), Yagua, Younuo Bunu, Bharmauri, Mixtec of the Puebla-Oaxaca border, Nupri, Ayoreo, Moyon, Utsat, Mussau-Emira, Narim, Camsá, Crow, Wano, Menik, Teribe (Panama), Yucatec, Sayultec, Juhur (Caucasus), Baleasang, Benga, Boni, Brokshat, East Greenlandic, Eastern Khanty, Harsusi, Hozo, Kamara, Kuk, Lai, Limirong Tibetan, Mohawk (Akwesasne, St. Regis), Palu'e, Pukur, Savi, U, Waima'a, Bahing, Bisu, Wari, Pakan, Yuracaré, Chatino of the western lowlands, Bolo, Sila, Achuar, Bai, Banka, Culina (Peru), Gadang, Laomian (China), Laomian (Myanmar), Lhokpu, Urak Lawoi (Malaysia), Urak Lawoi (Thailand), Zirenkel, Vumbu, Yasa, Mang (China), Mang (Viet Nam), Tlachichilco Tepehua, Blackfoot (Canada), Maremgi, Kulfa, Yine, Ngäbere (Costa Rica), Apurinã, Ashkun, Athpahariya, Ava-Guaraní, Bayso, Bori, Chepya, Damana, Duguza, Gats'ama - Ganjule - Harro, Jangshung, Kari'ña (French Guyana), Khamnigan Mongol, Koreguaje, Milang, Mocoví, Mpi, Nyishangba, Prasun, Sarwa, Tchitchege, Tinan, Tsafiki, Ushojo, Bulgebi, Waigali, Wotapuri-Katarqalai, Wutun, Candoshi, Mixtec of the central Ravine, Kendeje, Hunzib, Cashibo-Cacataibo, Nila (Seram Island), Shixing, Darma, Byangsi, Pasing, Yamphu, Carapana (Colombia), Bagupi, Atemble, Yan-nhangu, Cheyenne (Montana), Côông, Yiddish (Europe), Ritharrngu, Kari'ña (Brazil), Yankunytjatjara, Mafea, Huehuetla Tepehua, Kadiwéu, Southern Tiwa (Isleta Pueblo), Southern Tiwa (Sandia Pueblo), Tewa (Arizona), Somm, Chiquihuitlán Mazatec, Hupda (Colombia), Kanashi, Repanbitip, Ngarinyin, Khamba, O'odham (Mexico), Lishpa, Mescalero-Chiricahua Apache (New Mexico), Wik Ngathan, Numao Bunu, Palenque Creole, Pong, Ngombe, Bororo, Saba, Triw, Chɨlɨng, Kāgate, Oirata, Harakmbut, Manjui, Te'un (Seram Island), Ujir, Likum, Dakkang, Savo, Tektitek, Guayabero, Mixtec of the southwest of Puebla, Chipaya, Djinang, Mixtec of Villa de Tututepec, Blackfoot (United States of America), Bola, Adnyamathanha, Bong'om, Central Siberian Yupik (St. Lawrence Island), Dakpa, Northern Tutchone, Tutuba, Chali, Polonomombauk, Zangskari, Dampelas, Nahukwa, Piu, Okanagan, Gorap, Hu, Hung, Dengalu, Inkhokvari, Jiongnai Bunu, Suarmin, Kaco', Mlabri, Tupari, Khowa, Kujarge, Quechan, Papapana, May, Mt. Iraya Agta, Mòcheno, Hiw, Cubeo (Brazil), North Greenlandic, Amblong, Ormuri, Aikana, Chihuahua Lower Pima, Pareci, Meriam Mir, Zapotec of the Southern mountains, northwest lowlands, Pasi, Mwatebu, Kuurinji, Central Ojibwe, Bahonsuai, Beaver, Resian, Sach, Sobei, Thavung (Laos), Tum, Zaiwa, ǁAni, Buglé, Kao, Kadai, Hidatsa, South Slavey, Dorig, Doga, Kua, Che Wong, Chawte, Inuinnaqtun, Batak, Antakirinya, Voh-Koné dialects, Cocopa (Mexico), Zapotec of the Valleys, west, Pwaamèi, Musom, Emplawas, Nukuoro, Tiri, Garuwahi, K'iche' (Mexico), Ruc, Mixtec of Santa Cruz Itundujia, Kaibobo, Caquinte Campa, Zapotec of the Southern mountains, northeast, Alabama, Waru, Vera'a, Vedda, Pukapukan, Javaé, Panasuan, Thaayorre, Piaroa (Colombia), Phong, Taos, Kaike, Maniq, Ese eja, Mixtec of Santa Inés de Zaragoza, North Slavey, A'ingae / Cofan (Ecuador), Kalaw Lagaw Ya, Brokkat, Mok (China), Ngatikese Men's Creole, Dakota, Matlatzinca, Tilung, Southern Zoque, Blablanga, Benggoi, Nemi, Desano (Brazil), Northern Pame, Faetar, Laiyolo, Teanu, Nadëb, Orowe, Chatong, Ts'ixa, Talondo, Norfolk-Pitcairn (Norfolk), Pupeo, Northern Paiute (Nevada), Nunatsiavummiutut, Koroni, Kalao, Shuswap, Zapotec of Zimatlán de Álvarez, Chilcotin, Cimbrian, Chácobo, Yuhup (Colombia), Abai Sungai, Zapotec of the Southern mountains, eastern lowlands, Alabugat Tatar, Hinukh, Valle Nacional Chinantec, Tolomako, Siona  Secoya (Peru), Koasati (Texas), Koasati (Louisiana), Demisa, Chatino of Zacatepec, Anuki, Malecite, Imeraguen, Swoeng, Narpa, Walmajarri, Archi, Toratán, Tomadino, Yaqui (United States of America), Taloki, Taikat, Zapotec of San Antonino el Alto, Aheu, Bataan Ayta, Black Mountain, Havasupai, Laha (Son La), Laha (Lao Cai), Laghuu, Kundal Shahi, Khvarshi"
